{
  "schema": "host-bridge.release-set.v1",
  "releaseSetId": "hbrs-3d834c0f075f3122ac566e9a",
  "status": "planned",
  "source": {
    "repository": "leike0813/zotero-agents",
    "commit": "c1bb1d215506c61ccedd872846191e15688bef83"
  },
  "protocol": "host-bridge.v1",
  "cliSchema": "zotero-bridge.cli.v2",
  "cli": {
    "schema": "zotero-bridge-cli-release.v1",
    "version": "0.3.0",
    "buildFingerprint": "7332a3f4c286d5d7c3d4571c5bcfec9cdfd7faee0abec14a98d91947d3944822",
    "binariesBuildFingerprint": "7332a3f4c286d5d7c3d4571c5bcfec9cdfd7faee0abec14a98d91947d3944822",
    "binaryAggregateSha256": "a0a762d9373b66d8a884e65ded2b46d09036d0677367a6981652b98ad44a6c70",
    "commandCatalogChecksum": "9f3f82cc60299963ed2660e1c08a9de46db277ef57e199cbad04dd7e14227b40",
    "binaries": [
      {
        "platform": "win32-x64",
        "binary": "zotero-bridge.exe",
        "sha256": "eac1c41701d00db66dde6e73e953c693b06dfd8fae48e49268f567f40c283b7a",
        "bytes": 2596352
      },
      {
        "platform": "darwin-x64",
        "binary": "zotero-bridge",
        "sha256": "26a2a5b69e2ce3b00f4c9138355a00db5d0d05824cec214f637af117986d19a5",
        "bytes": 2613056
      },
      {
        "platform": "darwin-arm64",
        "binary": "zotero-bridge",
        "sha256": "fce872a4af930ea3b7c113600c03fe56e0635443225926f88a1ee2a50960f5e0",
        "bytes": 2424864
      },
      {
        "platform": "linux-x86",
        "binary": "zotero-bridge",
        "sha256": "5754922ffaaf108fe285674e199a34e037dfff9649da14022aade87db129efa5",
        "bytes": 2643136
      },
      {
        "platform": "linux-x64",
        "binary": "zotero-bridge",
        "sha256": "18510ca1f85d1ffa1a5c9e5375078f1af5dbd7295fb5478f0a7d35b3e552b64a",
        "bytes": 2484864
      },
      {
        "platform": "linux-arm",
        "binary": "zotero-bridge",
        "sha256": "d45ab2ddb1f549bcbe77c214dac22c4ec99f6883ba57609e0a08f64b87389fa5",
        "bytes": 2105196
      },
      {
        "platform": "linux-arm64",
        "binary": "zotero-bridge",
        "sha256": "00df6fff8bcc6641673115600d2efe489562ba6d9f49eea57aa90aa6e86b684e",
        "bytes": 2169304
      }
    ],
    "prebuildRequired": false,
    "identity": {
      "schema": "host-bridge.surface-identity.v2",
      "protocol": "host-bridge.v1",
      "cliSchema": "zotero-bridge.cli.v2",
      "version": "0.3.0",
      "buildFingerprint": "7332a3f4c286d5d7c3d4571c5bcfec9cdfd7faee0abec14a98d91947d3944822",
      "commandCatalogChecksum": "9f3f82cc60299963ed2660e1c08a9de46db277ef57e199cbad04dd7e14227b40"
    }
  },
  "surfaces": {
    "cliBundle": {
      "version": "0.3.1",
      "contentDigest": "8805279187aa23055aa5529408e77f62c12df0378d22920f07ff2804bd20026d",
      "repository": "leike0813/zotero-agents",
      "mutableRef": "host-bridge/zotero-bridge-cli-bundle",
      "immutableTag": "host-bridge/hbrs-3d834c0f075f3122ac566e9a",
      "cliIdentity": {
        "schema": "host-bridge.surface-identity.v2",
        "protocol": "host-bridge.v1",
        "cliSchema": "zotero-bridge.cli.v2",
        "version": "0.3.0",
        "buildFingerprint": "7332a3f4c286d5d7c3d4571c5bcfec9cdfd7faee0abec14a98d91947d3944822",
        "commandCatalogChecksum": "9f3f82cc60299963ed2660e1c08a9de46db277ef57e199cbad04dd7e14227b40"
      }
    },
    "libraryAgent": {
      "version": "0.3.1",
      "contentDigest": "a0c81445ed2d78481463321d21bcaa3f5de789e352752faf2de6f6d7b5c50a02",
      "repository": "leike0813/zotero-library-agent-bundle",
      "mutableRef": "main",
      "immutableTag": "host-bridge/hbrs-3d834c0f075f3122ac566e9a",
      "cliIdentity": {
        "schema": "host-bridge.surface-identity.v2",
        "protocol": "host-bridge.v1",
        "cliSchema": "zotero-bridge.cli.v2",
        "version": "0.3.0",
        "buildFingerprint": "7332a3f4c286d5d7c3d4571c5bcfec9cdfd7faee0abec14a98d91947d3944822",
        "commandCatalogChecksum": "9f3f82cc60299963ed2660e1c08a9de46db277ef57e199cbad04dd7e14227b40"
      }
    },
    "librarianProfile": {
      "version": "0.3.1",
      "contentDigest": "483ccf5e8bd90fe7e322bdf3cdc5e226a7e0bcf3ac4a422b5d14eacc6ca44dbf",
      "repository": "leike0813/zotero-librarian-profile",
      "mutableRef": "main",
      "immutableTag": "host-bridge/hbrs-3d834c0f075f3122ac566e9a",
      "cliIdentity": {
        "schema": "host-bridge.surface-identity.v2",
        "protocol": "host-bridge.v1",
        "cliSchema": "zotero-bridge.cli.v2",
        "version": "0.3.0",
        "buildFingerprint": "7332a3f4c286d5d7c3d4571c5bcfec9cdfd7faee0abec14a98d91947d3944822",
        "commandCatalogChecksum": "9f3f82cc60299963ed2660e1c08a9de46db277ef57e199cbad04dd7e14227b40"
      }
    }
  }
}
